{
  "phase": "strategy",
  "source": "explicit-user-attestation",
  "decision": "approve",
  "reviewer": "Ruckus000",
  "dimensions": {
    "problemFraming": 5,
    "evidenceQuality": 4,
    "assumptionRisk": 4,
    "taskFit": 5,
    "traceability": 5
  },
  "evidenceRefs": [
    "project",
    "evidenceBrief",
    "experienceStrategy",
    "requirementsMap"
  ],
  "acknowledgedFindings": [],
  "rationale": "Ruckus000 explicitly approved the current Strategy after the UX council revisions. Direct user, accessibility, legal, and native evidence gaps remain registered as assumptions and unknowns; direction validation is required before implementation.",
  "approvalDigest": "sha256:65711ff661ea85b4a70214838fb0015647d1ebf515b02a827ba06854561fb229",
  "createdAt": "2026-07-20T01:30:07Z",
  "signature": {
    "algorithm": "Ed25519",
    "keyId": "sha256:f6113e1a71bf331acde736c05aac8d2977d838434fa0ba14f430e6bbc0115553",
    "value": "FwvI8Iz601Za8t2tZHQVq/V+IDRGGWNphOION3U6/tta93iDI27nf5EF8pikIt6YCrDGz2aF3IJ6uaGJvMLCDg=="
  }
}
